{
  "image_id": "noisy-mutated-01",
  "chart_type": "bar",
  "bars": [
    {
      "bar_id": "bar-1",
      "category": "Jan",
      "value": 20.52,
      "bbox": [
        162,
        313,
        272,
        392
      ],
      "confidence": 0.68,
      "matched_label": "Jan",
      "top_y": 313,
      "bottom_y": 392,
      "value_source": "axis_mapping"
    },
    {
      "bar_id": "bar-2",
      "category": "Feb",
      "value": 38.44,
      "bbox": [
        338,
        244,
        450,
        392
      ],
      "confidence": 0.66,
      "matched_label": "Feb",
      "top_y": 244,
      "bottom_y": 392,
      "value_source": "axis_mapping"
    },
    {
      "bar_id": "bar-3",
      "category": "Mar",
      "value": 75.32,
      "bbox": [
        517,
        102,
        626,
        392
      ],
      "confidence": 0.67,
      "matched_label": "Mar",
      "top_y": 102,
      "bottom_y": 392,
      "value_source": "axis_mapping"
    }
  ],
  "x_axis_labels": [
    "Jan",
    "Feb",
    "Mar"
  ],
  "y_axis": {
    "label_text": "Rainfall (mm)",
    "unit_text": "mm",
    "label_bbox": [
      170,
      26,
      610,
      58
    ],
    "confidence": 0.59,
    "tick_labels": [
      {
        "text": "80",
        "parsed_value": 80.0,
        "bbox": [
          33,
          71,
          119,
          97
        ],
        "confidence": 0.72
      },
      {
        "text": "60",
        "parsed_value": 60.0,
        "bbox": [
          33,
          148,
          119,
          174
        ],
        "confidence": 0.7
      },
      {
        "text": "40",
        "parsed_value": 40.0,
        "bbox": [
          33,
          223,
          119,
          249
        ],
        "confidence": 0.84
      },
      {
        "text": "20",
        "parsed_value": 20.0,
        "bbox": [
          33,
          302,
          119,
          328
        ],
        "confidence": 0.81
      },
      {
        "text": "0",
        "parsed_value": 0.0,
        "bbox": [
          33,
          379,
          119,
          405
        ],
        "confidence": 0.82
      }
    ],
    "axis_line_x": 129,
    "baseline_y": 392,
    "top_y": 84,
    "zero_line_y": null,
    "mapping": {
      "min_value": 0.0,
      "max_value": 80.0,
      "pixels_per_unit": 3.85,
      "scale_mode": "zero_baseline",
      "value_direction": "positive_up",
      "readable": true
    },
    "backend": "template"
  },
  "extraction_confidence": 0.72,
  "provenance": {
    "extractor_id": "chart-v2",
    "extractor_version": "0.2.0",
    "backend": "template",
    "metadata_source": "file",
    "dependency_versions": {
      "mcp": "1.0.0",
      "jsonschema": "4.25.1",
      "numpy": "1.24.3",
      "pillow": "12.2.0"
    },
    "environment": {}
  },
  "gaps": [],
  "metadata": {
    "chart_version": "v2",
    "axis_mode": "zero_baseline",
    "dataset_case": "noisy-mutated-01",
    "backend": "template"
  }
}