{
  "image_id": "rw-public-ambiguous-01",
  "chart_type": "bar",
  "bars": [
    {
      "bar_id": "bar-1",
      "category": "Malaysia",
      "value": null,
      "bbox": [
        165,
        301,
        271,
        390
      ],
      "confidence": 0.86,
      "matched_label": "Malaysia",
      "top_y": 301,
      "bottom_y": 390,
      "value_source": "axis_mapping"
    },
    {
      "bar_id": "bar-2",
      "category": "Thailand",
      "value": null,
      "bbox": [
        341,
        206,
        448,
        390
      ],
      "confidence": 0.86,
      "matched_label": "Thailand",
      "top_y": 206,
      "bottom_y": 390,
      "value_source": "axis_mapping"
    },
    {
      "bar_id": "bar-3",
      "category": "Vietnam",
      "value": null,
      "bbox": [
        518,
        135,
        624,
        390
      ],
      "confidence": 0.86,
      "matched_label": "Vietnam",
      "top_y": 135,
      "bottom_y": 390,
      "value_source": "axis_mapping"
    }
  ],
  "x_axis_labels": [
    "Malaysia",
    "Thailand",
    "Vietnam"
  ],
  "y_axis": {
    "label_text": "Population (millions)",
    "unit_text": "millions",
    "label_bbox": [
      170,
      26,
      610,
      58
    ],
    "confidence": 1.0,
    "tick_labels": [
      {
        "text": null,
        "parsed_value": null,
        "bbox": [
          33,
          71,
          119,
          97
        ],
        "confidence": 0.0
      },
      {
        "text": null,
        "parsed_value": null,
        "bbox": [
          33,
          147,
          119,
          173
        ],
        "confidence": 0.0
      },
      {
        "text": null,
        "parsed_value": null,
        "bbox": [
          33,
          224,
          119,
          250
        ],
        "confidence": 0.0
      },
      {
        "text": null,
        "parsed_value": null,
        "bbox": [
          33,
          301,
          119,
          327
        ],
        "confidence": 0.0
      },
      {
        "text": null,
        "parsed_value": null,
        "bbox": [
          33,
          378,
          119,
          404
        ],
        "confidence": 0.0
      }
    ],
    "axis_line_x": 129,
    "baseline_y": null,
    "top_y": 84,
    "zero_line_y": null,
    "mapping": null,
    "backend": "template"
  },
  "extraction_confidence": 0.4,
  "provenance": {
    "extractor_id": "chart-v2",
    "extractor_version": "0.2.0",
    "backend": "template",
    "metadata_source": "file",
    "dependency_versions": {
      "mcp": "1.0.0",
      "jsonschema": "4.25.1",
      "numpy": "1.24.3",
      "pillow": "12.2.0"
    },
    "environment": {}
  },
  "gaps": [
    {
      "code": "insufficient_tick_evidence",
      "message": "Every detected gridline requires a readable tick label before deriving the axis scale.",
      "check_ids": [
        "axis-scale-readable",
        "axis-scale-monotonic",
        "bar-values-match-data"
      ]
    },
    {
      "code": "bar_value_unresolved",
      "message": "Unable to derive a stable numeric value for bar 1 from axis mapping.",
      "check_ids": [
        "bar-values-match-data"
      ]
    },
    {
      "code": "bar_value_unresolved",
      "message": "Unable to derive a stable numeric value for bar 2 from axis mapping.",
      "check_ids": [
        "bar-values-match-data"
      ]
    },
    {
      "code": "bar_value_unresolved",
      "message": "Unable to derive a stable numeric value for bar 3 from axis mapping.",
      "check_ids": [
        "bar-values-match-data"
      ]
    },
    {
      "code": "axis_scale_unreadable",
      "message": "Axis scale could not be derived from the available tick evidence.",
      "check_ids": [
        "axis-scale-readable",
        "bar-values-match-data"
      ]
    }
  ],
  "metadata": {
    "chart_version": "v2",
    "axis_mode": "zero_baseline",
    "dataset_case": "rw-public-ambiguous-01",
    "backend": "template"
  }
}