{
  "image_id": "rw-public-golden-03",
  "chart_type": "bar",
  "bars": [
    {
      "bar_id": "bar-1",
      "category": "Malaysia",
      "value": 35.18,
      "bbox": [
        165,
        301,
        271,
        390
      ],
      "confidence": 0.83,
      "matched_label": "Malaysia",
      "top_y": 301,
      "bottom_y": 390,
      "value_source": "axis_mapping"
    },
    {
      "bar_id": "bar-2",
      "category": "Thailand",
      "value": 72.31,
      "bbox": [
        341,
        206,
        448,
        390
      ],
      "confidence": 0.83,
      "matched_label": "Thailand",
      "top_y": 206,
      "bottom_y": 390,
      "value_source": "axis_mapping"
    },
    {
      "bar_id": "bar-3",
      "category": "Vietnam",
      "value": 100.07,
      "bbox": [
        518,
        135,
        624,
        390
      ],
      "confidence": 0.84,
      "matched_label": "Vietnam",
      "top_y": 135,
      "bottom_y": 390,
      "value_source": "axis_mapping"
    }
  ],
  "x_axis_labels": [
    "Malaysia",
    "Thailand",
    "Vietnam"
  ],
  "y_axis": {
    "label_text": "Population (millions)",
    "unit_text": "millions",
    "label_bbox": [
      170,
      26,
      610,
      58
    ],
    "confidence": 1.0,
    "tick_labels": [
      {
        "text": "120",
        "parsed_value": 120.0,
        "bbox": [
          33,
          71,
          119,
          97
        ],
        "confidence": 0.89
      },
      {
        "text": "90",
        "parsed_value": 90.0,
        "bbox": [
          33,
          147,
          119,
          173
        ],
        "confidence": 0.88
      },
      {
        "text": "60",
        "parsed_value": 60.0,
        "bbox": [
          33,
          224,
          119,
          250
        ],
        "confidence": 0.83
      },
      {
        "text": "30",
        "parsed_value": 30.0,
        "bbox": [
          33,
          301,
          119,
          327
        ],
        "confidence": 0.81
      },
      {
        "text": "0",
        "parsed_value": 0.0,
        "bbox": [
          33,
          378,
          119,
          404
        ],
        "confidence": 0.9
      }
    ],
    "axis_line_x": 129,
    "baseline_y": 391,
    "top_y": 84,
    "zero_line_y": null,
    "mapping": {
      "min_value": 0.0,
      "max_value": 120.0,
      "pixels_per_unit": 2.5583,
      "scale_mode": "zero_baseline",
      "value_direction": "positive_up",
      "readable": true
    },
    "backend": "template"
  },
  "extraction_confidence": 0.87,
  "provenance": {
    "extractor_id": "chart-v2",
    "extractor_version": "0.2.0",
    "backend": "template",
    "metadata_source": "file",
    "dependency_versions": {
      "mcp": "1.0.0",
      "jsonschema": "4.25.1",
      "numpy": "1.24.3",
      "pillow": "12.2.0"
    },
    "environment": {}
  },
  "gaps": [],
  "metadata": {
    "chart_version": "v2",
    "axis_mode": "zero_baseline",
    "dataset_case": "rw-public-golden-03",
    "backend": "template"
  }
}