{
  "image_id": "rw-render-ambiguous-04",
  "chart_type": "bar",
  "bars": [
    {
      "bar_id": "bar-1",
      "category": null,
      "value": null,
      "bbox": [
        163,
        313,
        273,
        390
      ],
      "confidence": 0.36,
      "matched_label": null,
      "top_y": 313,
      "bottom_y": 390,
      "value_source": "axis_mapping"
    },
    {
      "bar_id": "bar-2",
      "category": null,
      "value": null,
      "bbox": [
        339,
        236,
        450,
        390
      ],
      "confidence": 0.36,
      "matched_label": null,
      "top_y": 236,
      "bottom_y": 390,
      "value_source": "axis_mapping"
    },
    {
      "bar_id": "bar-3",
      "category": null,
      "value": null,
      "bbox": [
        516,
        160,
        626,
        390
      ],
      "confidence": 0.36,
      "matched_label": null,
      "top_y": 160,
      "bottom_y": 390,
      "value_source": "axis_mapping"
    }
  ],
  "x_axis_labels": [
    null,
    null,
    null
  ],
  "y_axis": {
    "label_text": "Rainfall (mm)",
    "unit_text": "mm",
    "label_bbox": [
      170,
      26,
      610,
      58
    ],
    "confidence": 0.7,
    "tick_labels": [
      {
        "text": null,
        "parsed_value": null,
        "bbox": [
          34,
          71,
          120,
          97
        ],
        "confidence": 0.0
      },
      {
        "text": null,
        "parsed_value": null,
        "bbox": [
          34,
          148,
          120,
          174
        ],
        "confidence": 0.0
      },
      {
        "text": null,
        "parsed_value": null,
        "bbox": [
          34,
          223,
          120,
          249
        ],
        "confidence": 0.0
      },
      {
        "text": null,
        "parsed_value": null,
        "bbox": [
          34,
          301,
          120,
          327
        ],
        "confidence": 0.0
      },
      {
        "text": null,
        "parsed_value": null,
        "bbox": [
          34,
          378,
          120,
          404
        ],
        "confidence": 0.0
      }
    ],
    "axis_line_x": 130,
    "baseline_y": null,
    "top_y": 84,
    "zero_line_y": null,
    "mapping": null,
    "backend": "template"
  },
  "extraction_confidence": 0.2,
  "provenance": {
    "extractor_id": "chart-v2",
    "extractor_version": "0.2.0",
    "backend": "template",
    "metadata_source": "file",
    "dependency_versions": {
      "mcp": "1.0.0",
      "jsonschema": "4.25.1",
      "numpy": "1.24.3",
      "pillow": "12.2.0"
    },
    "environment": {}
  },
  "gaps": [
    {
      "code": "insufficient_tick_evidence",
      "message": "Every detected gridline requires a readable tick label before deriving the axis scale.",
      "check_ids": [
        "axis-scale-readable",
        "axis-scale-monotonic",
        "bar-values-match-data"
      ]
    },
    {
      "code": "missing_bar_label",
      "message": "Unable to confidently match x-axis label for bar 1.",
      "check_ids": [
        "bar-values-match-data"
      ]
    },
    {
      "code": "bar_value_unresolved",
      "message": "Unable to derive a stable numeric value for bar 1 from axis mapping.",
      "check_ids": [
        "bar-values-match-data"
      ]
    },
    {
      "code": "missing_bar_label",
      "message": "Unable to confidently match x-axis label for bar 2.",
      "check_ids": [
        "bar-values-match-data"
      ]
    },
    {
      "code": "bar_value_unresolved",
      "message": "Unable to derive a stable numeric value for bar 2 from axis mapping.",
      "check_ids": [
        "bar-values-match-data"
      ]
    },
    {
      "code": "missing_bar_label",
      "message": "Unable to confidently match x-axis label for bar 3.",
      "check_ids": [
        "bar-values-match-data"
      ]
    },
    {
      "code": "bar_value_unresolved",
      "message": "Unable to derive a stable numeric value for bar 3 from axis mapping.",
      "check_ids": [
        "bar-values-match-data"
      ]
    },
    {
      "code": "axis_scale_unreadable",
      "message": "Axis scale could not be derived from the available tick evidence.",
      "check_ids": [
        "axis-scale-readable",
        "bar-values-match-data"
      ]
    }
  ],
  "metadata": {
    "chart_version": "v2",
    "axis_mode": "zero_baseline",
    "dataset_case": "rw-render-ambiguous-04",
    "backend": "template"
  }
}